<?xml version="1.0" encoding="UTF-8"?>
<!DOCTYPE composition SYSTEM "ex3.dtd">
<composition>
    <auteur>Floristore</auteur>
    <date_de_creation>29/02/2001</date_de_creation>
    <fleuriste>
        <ville>Paris</ville>
    </fleuriste>
    <composants>
        <vase>
            <matiere>Porcelaine</matiere>
            <taille>50X70 cm</taille>
        </vase>
        <fleurs>
            <nature>Europeenne</nature>
            <item>Tulipe</item>
            <item>Glaieul</item>
            <item>Marguerite</item>
        </fleurs>
    </composants>
</composition>
